{
  "id": "novolis.economy.models.smallopenregionaltrade",
  "name": "Novolis.Economy.Models.SmallOpenRegionalTrade",
  "type": "nuget",
  "version": "2026.1.1.0",
  "repository": "https://github.com/Novolis-Platform/novolis-economy",
  "packageId": "Novolis.Economy.Models.SmallOpenRegionalTrade"
}
